{"$schema":"http://json-schema.org/draft-07/schema#","description":"Typed handoff between muse-router stages. Paths, not contents; every claim carries file:line.","properties":{"findings":{"items":{"properties":{"claim":{"type":"string"},"file":{"type":"string"},"line":{"type":"integer"}},"required":["file","line","claim"],"type":"object"},"type":"array"},"goal":{"type":"string"},"instructionFiles":{"items":{"type":"string"},"type":"array"},"nextSteps":{"items":{"type":"string"},"type":"array"},"outOfScope":{"items":{"type":"string"},"type":"array"},"project":{"type":"string"},"worktree":{"type":"string"}},"required":["goal","project","findings","nextSteps"],"title":"muse-router handoff","type":"object"}