{"findings":[{"claim":"Loop-guard ORDER position (line 44), after read-economy (line 43); built-in, opt-in via Extensions sheet","file":"src/server/reload.ts","line":44},{"claim":"Third exactly identical tool call in one turn is blocked, and the block says so (behavior sentence, lines 2-3)","file":"src/server/extensions/loop-guard.ts","line":2}],"goal":"Validate loop-guard battery on copy server","instructionFiles":["docs/self-editing.md"],"nextSteps":["Enable loop-guard on copy Extensions sheet","Run three identical failing calls, confirm third blocked"],"outOfScope":["Live config.json edit"],"project":"oh-my-pocket","worktree":"/home/tcrypt/projects/oh-my-pocket"}